<?xml version="1.0" encoding="UTF-8"?>
<?xml-stylesheet type="text/xsl" href="clasificacion.xslt"?>
<tabla xmlns="http://www.example.com/clasificacion"
       xmlns:xsi="http://www.w3.org/2001/XMLSchema-instance"
       xsi:schemaLocation="http://www.example.com/clasificacion clasificacion.xsd">
    <fila>
        <posicion>1</posicion>
        <equipo> A</equipo>
        <puntos>10</puntos>
    </fila>
    <fila>
        <posicion>2</posicion>
        <equipo> B</equipo>
        <puntos>8</puntos>
    </fila>
    <fila>
        <posicion>3</posicion>
        <equipo> C</equipo>
        <puntos>6</puntos>
    </fila>
</tabla>